{
  "report_version": 1,
  "from_contract": 1,
  "to_contract": 2,
  "mode": "dry-run",
  "apply_allowed": false,
  "findings": [
    {
      "kind": "decision",
      "code": "EVERGREEN_TYPE_AMBIGUOUS",
      "message": "Choose Concept or Synthesis for the v1 Evergreen Note.",
      "status": "unresolved",
      "object_id": "note_01JSTAG7N9Q3V5X8Y2Z4A6B8D1"
    }
  ]
}
