{
  "report_version": 1,
  "from_contract": 1,
  "to_contract": 2,
  "mode": "dry-run",
  "apply_allowed": false,
  "findings": [
    {
      "kind": "decision",
      "code": "SOURCE_RELATION_SEMANTICS_AMBIGUOUS",
      "message": "A non-Literature source_ids entry cannot be guessed as cites or synthesizes.",
      "status": "unresolved",
      "object_id": "note_01JSTAG7N9Q3V5X8Y2Z4A6B8D3",
      "details": {
        "inference_policy": "prohibited",
        "candidate_relation_types": ["cites", "synthesizes"]
      }
    }
  ]
}
