{
  "report_version": 1,
  "from_contract": 1,
  "to_contract": 2,
  "mode": "dry-run",
  "apply_allowed": false,
  "findings": [
    {
      "kind": "blocker",
      "code": "FACT_CITATION_UNRESOLVED",
      "message": "A v1 fact block has no precise Source locator.",
      "status": "unresolved",
      "object_id": "note_01JSTAG7N9Q3V5X8Y2Z4A6B8D0"
    }
  ]
}
