{
  "report_version": 1,
  "from_contract": 1,
  "to_contract": 2,
  "mode": "dry-run",
  "apply_allowed": true,
  "findings": [
    {
      "kind": "change",
      "code": "SECTION_ROLE_MAPPED",
      "message": "Mapped sec_my_interpretation to role human.",
      "status": "proposed",
      "object_id": "note_01JSTAG7N9Q3V5X8Y2Z4A6B8D0"
    }
  ]
}
